,id,head_ru,transliteration,literal,meaning,equivalents,transparency
218,219,КАМЕНЬ С ДУШИ СВАЛИЛСЯ,kamen’s dushy svalils’a,A stone has fallen off one’s heart.,"Someone feels relieved of a burden of an unpleasant, sad or oppressive feeling.",A load off one’s mind,0.0
219,220,КАМНЯ НА КАМНЕ HE ОСТАВИТЬ,kamn’a na kamn’e n’e ostavit’,Not to leave one stone upon another stone.,To criticize something severely by pointing out the weak points or faults; to utterly demolish an argument.,To pull/take something to pieces; to make mincemeat of something.,0.0
221,222,КАТАТЬСЯ КАК СЫР В МАСЛЕ,katattsa kak syr v masl’e,To be rolling like cheese in butter.,To be comfortably off.,To live in clover; to live on the fat of the land; to live like a king.,0.0
223,224,КАШИ НЕ СВАРИШЬ с кем-либо,kashy n’e svarish,You won’t cook kasha with someone.,You can’t get on with someone; you won’t get anywhere with someone; it’s difficult to work with someone.,,0.0
224,225,КИДАЕТ В ЖАР,kidayet v zhar,Thrown into a heat.,He/she becomes extremely agitated or anxious; he/she feels hot all over.,,0.0
225,226,КЛЕВАТЬ НОСОМ,kl’evat’ nosom,To peck with one’s nose.,To nod; to be drowsy.,,0.0
227,228,КОГДА РАК СВИСТНЕТ,kogda rak svisn’et,When the crayfish whistles.,No one knows when; never.,When pigs fly; when two Fridays come together,0.0
228,229,КОТ НАПЛАКАЛ,kot naplakal,Something the cat cried out.,Very little; practically nothing; nothing to speak of.,,0.0
229,230,КОШКИ СКРЕБУТ НА ДУШЕ,koshki skr’ebut na dushe,Cats are scratching on one’s soul.,"To be melancholy, sad, depressed; to be anxious about something.",To be sick at heart; to have the blues.,0.0
234,235,КРИЧАТЬ о чём-либо НА ВСЕХ ПЕРЕКРЁСТКАХ,krichat’ na vs’ekh p’er’ekr’ostkakh,To shout about something at all cross-roads.,To announce something in the most public manner possible; to make something generally known to a wide public; to talk constantly about something.,To cry/shout from the house-tops.,0.0
235,236,КРОВЬ С МОЛОКОМ,krov’ s molokom,Blood with milk.,"Someone with fresh complexion, in the best of health; one who looks quite well.",The very picture of health.,0.0
236,237,"КТО В ЛЕС, КТО ПО ДРОВА",kto v l’es kto po drova,"Some to the forest, some to gather firewood.",A phrase expressing lack of coordination or harmony (often said of singing or playing musical instruments),,0.0
240,241,КУСАТЬ СЕБЕ ЛОКТИ,kusat’ s’eb’e lokti,To bite one’s own elbows.,To be deeply vexed; to be upset over an irreparable loss of someone or something.,To cry over spilt milk; to kick oneself over a lost opportunity.,0.0
241,242,ЛЁГКАЯ РУКА,l’okhkaya ruka,A light hand.,Someone is known to bring luck to any kind of undertaking.,,0.0
242,243,ЛЁГОК НА ПОДЪЁМ,l’ogok na pod’yom,Easy on the ascent.,Always ready and willing to go somewhere or do something.,Quick off the mark; quick on one’s toes.,0.0
243,244,ЛЁД ТРОНУЛСЯ,l’od tronuls’a,The ice has begun to break.,A beginning has been made; things are moving.,,0.0
244,245,ЛЕЗТЬ В БУТЫЛКУ,l’ezt’ v butylku,To climb into the bottle.,"To be carried away by excitement, to lose self-control, to become suddenly or violently angry (usually without reason, over a mere trifle).",To fly off the handle; to blow one’s top.,0.0
245,246,ЛЕЗТЬ В ДУШУ,l’ezt’ v dushu,To climb into someone’s soul.,"To try to find out someone’s innermost feelings, thoughts, intentions; to win someone’s favour or confidence.",To worm oneself into someone’s favour/confidence,0.0
246,247,ЛЕЗТЬ ИЗ КОЖИ ВОН,l’ezt’ iz kozhy von,To climb out of one’s skin.,"To make a great effort; to do one’s utmost, to try one’s hardest.",To lean/bend over backwards; to go out of one’s way; to go all out.,0.0
248,249,ЛИТЬ КАК ИЗ ВЕДРА,lit’ kak iz v’edra,To pour as from a pail.,To rain heavily.,It rains cats and dogs,0.0
250,251,ЛОВИТЬ НА ЛЕТУ,lovit na l’etu,To catch something in flight.,"To be quick to comprehend or to learn something; to grasp something easily, at once.",To be quick on the uptake,0.0
251,252,ЛОВИТЬ кого-либо НА СЛОВЕ,lovit’ na slove,To catch one at one’s word.,To make someone do or promise to do what he said he would do.,To take someone at his word.,0.0
256,257,ЛОПНУТЬ КАК МЫЛЬНЫЙ ПУЗЫРЬ,lopnut’ kak myl’ny puzyr’,To burst like a soap-bubble.,"Said of something that proves to be unstable, ephemeral or easily destroyed.",,0.0
257,258,МАСТЕР НА ВСЕ РУКИ,mast’er na vs’e ruki,A master at all hands.,To be good at anything one undertakes; to show talent in anything one turns his hand to; a versatile worker.,A jack-of-all-trades,0.0
258,259,МАХНУТЬ РУКОЙ,makhnut’ rukoy,To wave one’s hand at something or someone.,To stop doing something or dealing with someone; not to care what happens; to give something up as a lost or hopeless cause.,,0.0
259,260,МЕДВЕДЬ НА УХО НАСТУПИЛ,m’edv’ed’ na ukho nastupil,A bear stepped on someone’s ear.,Someone has no ear for music; someone is quite tone-deaf.,,0.0
260,261,МЕДВЕЖЬЯ УСЛУГА,m’edv’ezh’ya usluga,A bear’s service.,A well-meant action having the opposite effect; clumsy assistance causing only more problems; a dubious benefit conferred on someone; a disservice.,,0.0
261,262,МЕНЯТЬ КУКУШКУ НА ЯСТРЕБА,m’en’at’ kukushku na yastr’eba,To exchange a cuckoo for a hawk.,To select the worst from among the worse; to be out of one’s reckoning; to miscalculate.,To back the wrong horse.,0.0
262,263,МЕРИТЬ НА СВОЙ АРШИН,m’erit’ na svoy arshyn,To measure by one’s own arshin.,To judge others by oneself; to apply one’s own standard to others.,To measure another’s corn by one’s own bushel,0.0
264,265,МИР ТЕСЕН,mir t’es’en,The world is cramped.,You may unexpectedly run across a person you know anywhere.,It’s a small world.,0.0
265,266,МНОГО ВОДЫ УТЕКЛО,mnogo vody ut’eklo,Much water has flowed away.,That was long ago; much has happened since; much has changed since.,A lot of water has flowed under the bridge since,0.0
266,267,МОРЕ ПО КОЛЕНО,mor’e po kol’eno,The sea is knee-deep.,One is unconcerned; one couldn’t care less; one is absolutely reckless.,Devil-may-care,0.0
267,268,МОТАТЬ СЕБЕ НА УС,motat s’eb’e na us,To wind something on one’s moustache,To observe something silently; to make a mental note of something.,Bite on that,0.0
268,269,МОЯ ХАТА С КРАЮ,moya khata s krayu,My hut is on the periphery.,This has nothing to do with me; it’s no business/concern of mine.,,0.0
270,271,МУТИТЬ ВОДУ,mutit’ vodu,To muddy the water.,To deliberately muddle matters; to stir up trouble; to confuse things.,,0.0
272,273,МЫШИНАЯ ВОЗНЯ,myshynaya vozn’a,Mice’s fussing.,Pointless fussing over trifles.,,0.0
273,274,НАБИТЬ РУКУ,nabit’ ruku,To strengthen one’s hand.,"To practice so as to acquire skill, to develop a good technique in something; to become a practiced hand at something; to give oneself a steady hand.",To get the knack of something,0.0
274,275,НАБРАТЬ В РОТ ВОДЫ,nabrat’ v rot vody,To fill one’s mouth with water.,To remain silent; not to utter a word.,To keep mum,0.0
276,277,НАВОСТРИТЬ ЛЫЖИ,navostrit’ lýzhy,To sharpen the skis.,"To flee, to run away.",To take to one’s heels; to show a clean pair of heels.,0.0
278,279,НАВЯЗНУТЬ В ЗУБАХ,nav’aznut’ v zubakh,To get stuck in one’s teeth.,To have had more than enough; to be sick and tired of something.,To set one’s teeth on edge.,0.0
279,280,НАДЕЯТЬСЯ КАК НА КАМЕННУЮ ГОРУ,nad’eyattsa kak na kam’ennuyu goru,To rely on someone as on a rock mountain.,To rely fully on someone or something.,,0.0
280,281,НАДУТЬ ГУБЫ,nadut’ guby,To blow up one’s lips.,"To be angry, to take offence wearing a sulky expression; to express dissatisfaction or displeasure; to be in a disagreeable mood.",To pout,0.0
281,282,НАЖИМАТЬ НА ВСЕ КНОПКИ,nazhimat’ na vs’e knopki,To press on all the buttons.,To use every direct or indirect means in order to attain a goal; to exert personal and private influence on a matter affecting oneself or others.,To pull wires/strings.,0.0
282,283,НАЖИМАТЬ НА ВСЕ ПЕДАЛИ,nazhimat’ na vs’e p’edali,To press all the pedals.,"To do everything in one’s power to carry out a task, a promise, etc.",To go all out,0.0
284,285,НАЙТИ СЕБЯ,nayti s’eb’a,To find oneself.,"To find and realize one’s vocation, calling; to determine one’s aptitude, bent or inclinations.",,0.0
287,288,НАЛОМАТЬ ДРОВ,nalomat’ drov,To break up some firewood,To commit follies; to make a mess of things.,,0.0
288,289,НАМЫЛИТЬ ШЕЮ,namylit’ sheyu,To soap someone’s neck.,To reprimand or criticize someone sharply; to give someone a good rating.,To haul someone over the coals; to give someone a dressing-down.,0.0
290,291,НАПУСТИТЬ ТУМАНУ,napustit’ tumanu,To let the fog in.,To obscure the issue; to befog something; to confuse things; to try to mislead someone,,0.0
291,292,НАСОЛИТЬ кому-либо,nasolit’,To salt someone.,To spite; to cause someone annoyance; to do someone a bad turn.,,0.0
293,294,НАХОДИТЬСЯ НА ТОЧКЕ ЗАМЕРЗАНИЯ,nakhodittsa na tochk’e zam’erzaniya,To be at freezing-point.,To remain in the same state or condition without developing or progressing; to be at a standstill.,,0.0
294,295,НАШЛА КОСА НА КАМЕНЬ,nashla kosa na kam’en’,The scythe has struck a stone.,"A clash of conflicting personalities, interests, opinions, etc.",One has met his match; diamond cut diamond,0.0
295,296,HE ВИДАТЬ КАК СВОИХ УШЕЙ,n’e vidat’ kak svoikh ushey,One won’t see it as his own ears.,"One will never see, get or possess something or someone.",You won’t see hide nor hair of something or someone; you have to kiss it good-bye.,0.0
298,299,НЕ ВИДЕТЬ СВЕТА БЕЛОГО,n’e videt’ sv’eta b’elovo,Not to see the white world.,"One is so burdened with work or cares that he has no peace, no rest and can’t lead a normal life.",,0.0
300,301,НЕ ЗА ГОРАМИ,n’e za gorami,Not beyond the hills.,Something is about to happen very soon.,Near at hand.,0.0
301,302,НЕ ЛЕЗТЬ ЗА СЛОВОМ В КАРМАН,n’e l’ezt’ za slovom v karman,Not to climb for a word into one’s pocket.,"To be quick to respond, to answer promptly and well; not to be at a loss for words.",To have a ready/ quick tongue.,0.0
302,303,НЕМ КАК РЫБА,n’em kak ryba,Dumb as a fish.,"Someone says very little or nothing; reserved, uncommunicative.",Close/dumb as an oyster; silent as a grave; tight-lipped,0.0
303,304,"НЕ МЫТЬЁМ, ТАК КАТАНЬЕМ",n’e myt’yom tak katan’yem,"If not by washing, then by mangling.","To try to get something; to annoy or vex someone by any means, right or wrong.",By hook or by crook.,0.0
304,305,НЕ НАХОДИТЬ СЕБЕ МЕСТА,n’e nakhodit’ s’eb’e m’esta,"To be extremely anxious, discontented; to fret; to worry;",to be extremely anxious; discontented; to fret; to worry; not to know what to do with oneself.,,0.0
305,306,НЕ НЮХАТЬ ПОРОХУ,n’e n’ukhat’ porokhu,Not to smell gun-powder.,Not to have been in combat.,,0.0
307,308,НЕ УДАРИТЬ В ГРЯЗЬ ЛИЦОМ,n’e udarit’ v gr’az’ litsom,Not to strike the mud with one’s face.,To maintain one’s dignity; to acquit oneself well; not to disgrace oneself; to try to appear at one’s best.,To put one’s best foot forward; to make a good showing.,0.0
309,310,НЕ ФУНТ ИЗЮМУ,n’e funt iz’umu,That’s not a pound of raisins,"It’s not a trifle; it’s not to be regarded as negligible or unimportant; it’s no light,matter; it’s no joke.",It’s not to be sneezed/sniffled at,0.0
310,311,НЕЧИСТ НА РУКУ,n’echist na ruku,Having an unclean hand.,"Inclined to stealing, swindling or cheating; dishonest, underhanded.",,0.0
311,312,HE ЧУЯТЬ НОГ ПОД СОБОЙ,n’e chuyat’ nog pod soboy,Not to feel one’s feet under oneself.,"To be very happy, to be highly delighted",To be beside oneself with joy; to tread/walk on air,0.0
312,313,НИ ДВА НИ ПОЛТОРА,ni dva ni poltora,Neither two nor one and a half.,Defies classification; neither good rior bad neither one thing nor the other.,,0.0
314,315,НИ ЗА КАКИЕ КОВРИЖКИ,ni za kakiye kovrizhki,Not for any gingerbread.,Not for anything; not on any account.,Not for the world; not on your life,0.0
316,317,НИ К СЕЛУ НИ К ГОРОДУ,ni k s’elu ni k gorodu,Neither to the village nor to the town.,"Beside the point, out of place; for no apparent reason; quite irrelevantly",Neither here nor there,0.0
317,318,НИ НА ЧТО HE ПОХОЖЕ,ni na shto n’e pokhozhe,It doesn’t look like anything.,Very bad; unthinkable; unheard of; like nothing on earth; that won’t do; that’s no good at all.,,0.0
318,319,НИ ПУХА НИ ПЕРА!,ni pukha ni p’era,Neither down nor feather.,Good luck!,,0.0
320,321,НОЖ ОСТРЫЙ,nozh ostry,A sharp knife.,"Something extremely unpleasant or painful; something is the source of annoyance, grief, etc.",Gall and wormwood; this is sheer agony/hell.,0.0
321,322,НОМЕР HE ПРОЙДЁТ,nom’er n’e proyd’ot,The number won’t pass through.,That won’t do; you can’t get away with it.,Nothing doing; that trick won’t work; that won’t wash.,0.0
323,324,НОСИТЬ ВОДУ РЕШЕТОМ,nosit’ vodu r’eshetom,To carry water in a sieve.,To do something useless; to waste time.,To plough the sand,0.0
324,325,НУЖЕН КАК ПРОШЛОГОДНИЙ СНЕГ,nuzhen kak proschlogodny sn’eg,As needed as last year’s snow,Here is no need to.,,0.0
326,327,ОБЕЩАТЬ ЗОЛОТЫЕ ГОРЫ,ob’eshchat’ zolotyye gory,To promise mountains of gold,To promise someone a fortune; to make extravagant promises.,To promise the moon,0.0
327,328,ОБИВАТЬ ПОРОГИ,obivat’ porogi,To knock against the thresholds.,To go frequently somewhere trying to obtain something; to apply or petition with dogged persistence.,To haunt someone’s threshold; to camp on someone’s doorstep,0.0
328,329,ОБРАТИТЬСЯ HE ПО АДРЕСУ,obratittsa n’e po adr’esu,To apply to the wrong address.,To come to the wrong person or place to get what one requires.,To come to the wrong shop,0.0
329,330,ОДИН КАК ПЕРСТ,odin kak p’erst,Alone as a finger.,All alone in the world; all by oneself; without kinfolk.,,0.0
330,331,"ОДНА НОГА ЗДЕСЬ, ДРУГАЯ ТАМ",odna noga zd’es’ drugaya tarn,"One foot’s here, the other’s there.","To go and fetch, to run and fetch; to do something very quickly, with lightning speed.",,0.0
331,332,ОДНОГО ПОЛЯ ЯГОДА,odnovo pol’a yagoda,A berry from the same field.,"They look alike; they are similar in disposition, tastes, etc.; they are well matched; they deserve each other; one is no better than the other.",Not a pin to choose between them; cut from the same cloth; birds of one feather,0.0
333,334,ОКАЗАТЬСЯ МЕЖДУ НЕБОМ И ЗЕМЛЁЙ,okazattsa m’ezhdu n’ebom i z’eml’oy,To find oneself between the sky and the earth.,,,0.0
335,336,ОКУНУТЬСЯ С ГОЛОВОЙ,konuttsa z golovoy,To plunge headlong,"To become utterly absorbed/engrossed in something; to be deeply immersed, irrevocably involved.",To be up to one’s ears in something; to throw oneself in something,0.0
336,337,ОПУСТИТЬ РУКИ,opustft’ rtiki,To lower one’s hands,"To lose interest; to become disappointed, depressed; to be disheartened",To lose heart,0.0
337,338,ОСТАВИТЬ С НОСОМ,ostavit’s nosom,To leave someone with his nose.,To leave someone without something he had hoped for; to make a fool of someone; to trick someone.,To leave someone holding the bag,0.0
338,339,ОСТАТЬСЯ НА БОБАХ,ostattsa na bobakh,To be left on the beans,To be left without something one has hoped for; to be out in one’s reckoning; to get nothing for one’s pains; to be left with nothing.,To be left holding the bag,0.0
339,340,ОСТАТЬСЯ У РАЗБИТОГО КОРЫТА,ostattsa u razbitovo koryta,To be left at the broken wash-tub.,"To be left with nothing, having lost everything one had; to be no better off than when one started.",To be back at the bottom of the ladder,0.0
340,341,ОТКЛАДЫВАТЬ НА ЧЁРНЫЙ ДЕНЬ,otkladyvat’ na chorny d’en’,To put aside for a black day,"To save or reserve something (usually one’s income) for time of trouble, for bad times.",To save/put by for a rainy day,0.0
341,342,ОТКРЫВАТЬ АМЕРИКУ,otkryvat’ am’eriku,To discover America.,To say something that everyone has long been aware of; to say or explain something that is already well known to everyone; to retail stale news.,The Dutch have taken Holland; Queen Ann is dead,0.0
343,344,ОТКРЫВАТЬ кому-либо ДУШУ/СЕРДЦЕ,otkryvat’ dushu/s’ertse,To open one’s soul / heart to someone.,To tell someone frankly of one’s innermost thoughts or feelings.,To lay bare one’s heart,0.0
344,345,ОТКРЫВАТЬ СВОИ КАРТЫ,otkryvat’ svoyi karty,To show one’s cards,To stop making secrets of one’s plans or intentions; to reveal candidly all one’s aims,To lay / put one’s cards on the table; to show one’s hand,0.0
345,346,ОТКУДА СЫР-БОР ЗАГОРЕЛСЯ,otkuda syr-bor zagor’els’a,Cf. To lay /put one’s,cards on the table; to show one’s hand.,That's how it all started.,0.0
346,347,ПАЛЕЦ О ПАЛЕЦ НЕ УДАРИТЬ,pal’ets o pal’ets n’e udarit’,Not to strike one finger against another.,To be idle; not to stir oneself; not to make the slightest effort to attain one’s goal.,Not to raise/lift a finger. Not to hurt a fly.,0.0
347,348,ПАЛКА О ДВУХ КОНЦАХ,palka o dvukh kontsakh,A staff with two ends.,Something that can have pleasant and unpleasant consequences; something that can bring good as well as harm.,A double-edged/two-edged weapon; it cuts both ways.,0.0
348,349,ПАЛЬЦА В РОТ НЕ КЛАДИ,pal’tsa v rot n’e kladi,Don’t put your finger in his/ her mouth.,Someone is not to be trifled with; with this man one must be scrupulously exact; one must be on one’s guard with him because he is likely to take advantage of another’s false step.,,0.0
349,350,ПАЛЬЦЕМ никого HE ТРОНУТЬ,pal’tsem n’e tronut’,Not to touch anyone with one’s finger,Not to do anyone any harm; not to hit someone.,Not to hurt a fly.,0.0
351,352,ПЕРВАЯ ЛАСТОЧКА,p’ervaya lastochka,The first swallow.,The first portent of something.,,0.0
352,353,ПЕРЕГИБАТЬ ПАЛКУ,p’er’egibat’ palku,To bend the stick.,To go beyond the appointed or accepted limit; to go to the extreme; to go too far; to overdo something.,To overshoot the mark.,0.0
353,354,ПЕРЕЛИВАТЬ ИЗ ПУСТОГО В ПОРОЖНЕЕ,p’erelivat’ is pustovo v porozhn’eye,To pour something from one empty vessel into another.,To waste time on something useless; to waste time in useless debate; to engage in idle chatter.,To mill the wind; to beat the air.,0.0
354,355,ПЕРЕЛОМИТЬ СЕБЯ,p’er’elomit’ seb’a,To break oneself in two,"To master oneself; to conquer one’s temper; to change one’s behaviour, character, habits; to restrain or suppress one’s feelings; to overcome oneself or something in oneself.",,0.0
355,356,ПЕРЕМЫВАТЬ КОСТОЧКИ,p’er’emyvat’ kostochki,To wash someone’s bones.,"To gossip, to say spiteful things about someone; to find detailed faults in a person.",To pick/pull someone to pieces,0.0
356,357,ПЕРЕПОЛНИТЬ ЧАШУ ТЕРПЕНИЯ,p’er’epolnit’ chashu t’erp’eniya,To overfill the cup of patience,To bring someone to the end of his endurance or patience; to exasperate someone; to be at the end of one’s tether,The last straw; to break the camel’s back,0.0
357,358,ПЕСЕНКА СПЕТА,p’es’enka sp’eta,One’s song has been sung.,One is near his end; one is ruined; it’s all done with him; he’s done for.,Someone’s goose is cooked,0.0
359,360,ПЛАВАТЬ КАК ТОПОР,plavat’ kak topor,To swim like an axe.,To be a poor swimmer or not to be able to swim at all.,To swim like a stone/like a tailor’s goose,0.0
360,361,ПЛАКАТЬСЯ В ЖИЛЕТКУ,plakattsa v zhil’etku,To weep into someone’s waistcoast,To bewail one’s fate seeking sympathy or consolation.,To cry on someone’s shoulder,0.0
362,363,ПЛЕВАТЬ В ПОТОЛОК,pl’evat’ v potolok,To spit at the ceiling,To do nothing at all; to be idle.,To fritter away the time; to sit twiddling,0.0
363,364,ПЛЕСТИСЬ КАК ЧЕРЕПАХА,pl’estis’ kak cher’epakha,To crawl like a tortoise.,To go very slowly; to drag oneself along; to trudge.,To go at a crawl; to move at a snail’s pace,0.0
366,367,ПОГНАТЬСЯ ЗА ДВУМЯ ЗАЙЦАМИ,pognattsa za dvum’a zaitsami,To pursue two different aims simultaneously ,To run after two hares.,,0.0
367,368,ПО ГОРЯЧИМ СЛЕДАМ,po gor’achim sl’edam,While the tracks are hot.,"Without losing time; immediately, directly after some event.",To let no grass grow under one’s feet,0.0
369,370,ПОДВЕСТИ кого-либо ПОД МОНАСТЫРЬ,podv’esti pod monastyr’,To bring someone up to a monastery. ,To put someone into a difficult position; to put someone in a tight spot; to cause someone much trouble.,,0.0
370,371,ПОДВОДНЫЕ КАМНИ,podvodnyye kamni,Under-water rocks.,A difficulty which is hard to foresee; a hidden obstacle; a snag.,,0.0
371,372,ПОД ГОРЯЧУЮ РУКУ,pod gor’achuyu ruku,Under a hot hand.,"One does something while still angry, excited, disturbed.",In the heat of the moment.,0.0
374,375,ПОДЛОЖИТЬ СВИНЬЮ,podlozhit’ svin’yu,To lay a pig near someone,To do a vile thing to someone on the sly.,To play a dirty/mean trick on someone,0.0
376,377,ПОДНИМАТЬ НА ЩИТ,podnimat’ na shchit,To raise something or someone up on the shield.,"To extol, to eulogize, to boost",To praise to the skies,0.0
378,379,ПОДНЯТЬ ВСЕХ НА НОГИ,podn’at’ vs’ekh na nogi,To raise everybody to his feet,To disturb everyone; to raise the alarm; to make everyone be more active; to rouse everyone to action.,,0.0
379,380,ПОДПИСЫВАТЬСЯ под чем-либо ОБЕИМИ РУКАМИ,podpisyvattsa ob’eimi rukami,To sign something with both hands.,To willingly agree to something; to fully endorse something.,,0.0
381,382,ПОД СУРДИНКУ,pod surdinku,With a mute.,"Softly, gently; on the quiet; on the sly; without being noticed",,0.0
383,384,ПОЙМАТЬ НА УДОЧКУ,poymat’ na udochku,To catch someone on one’s fishing line., By deceiving or outwitting someone to cause him to do something; to trick or to fool someone.,To catch out,0.0
384,385,"ПОКАЗАТЬ, ГДЕ РАКИ ЗИМУЮТ",pokazat’ gd’e raki zimuyut,To show someone where the crayfish winter,To teach someone a lesson; to punish someone; to scold someone severely.,To make it hot for someone; to show someone a thing or two,0.0
387,388,ПОКАЗЫВАТЬ ТОВАР ЛИЦОМ,pokazyvat’ tovar litsom,To show one’s goods from the right side.,To show a thing its best side; to make the best of something to show something to its full advantage; to display oneself in a favourable light.,,0.0
388,389,ПОЛНАЯ ЧАША,polnaya chasha,"One lives in plenty, in affluence, in luxury",,,0.0
390,391,ПОЛОЖИТЬ ЗУБЫ НА ПОЛКУ,polozhit’ zuby na polku,To put one’s teeth on a shelf,To go hungry; to starve.,To tighten one’s belt,0.0
391,392,ПОЛОЖИТЬ кого-либо НА ОБЕ ЛОПАТКИ,polozhit’ na ob’e lopatki,To put someone on both his shoulder-blades.,"To defeat an opponent in an argument, competition, contest, etc.; to beat someone.",,0.0
392,393,ПОЛОЖИТЬ что-либо ПОД СУКНО,polozhit’ pod sukno,To put something under the cloth.,To delay or postpone consideration of an official paper; to pigeon-hole a request or an application; to shelve a problem or a plan,,0.0
393,394,ПОПАДАТЬСЯ кому-либо НА ЯЗЫК,popadattsa na yazyk,To land on someone’s tongue,To become the subject of criticism.or gossip.,,0.0
396,397,ПОПАСТЬ В ТОЧКУ,popast’ v tochku,To hit the right point,To come to the right conclusion; to come at the crux of the matter; to say or do what is exactly right as if by guessing correctly what must be said or done in the circumstances.,To hit the nail on the head; to hit the bull’s eye/the mark,0.0
397,398,ПОПАСТЬ КАК КУР ВО ЩИ,popast’ kak kur vo shchi,To get oneself into the shchi*,To get into trouble; to be caught.,To get/fall into the soup; to get into hot water,0.0
398,399,ПОПАСТЬ кому-либо НА ЗУБОК,popast’ na zubok,To find oneself on someone’s little tooth,To be subjected to biting or sarcastic criticism; to become the butt of ridicule.,To be torn to pieces,0.0
