,id,head_ru,transliteration,literal,meaning,equivalents,transparency
399,400,"ПОПАСТЬ HE В БРОВЬ, А В ГЛАЗ",popast’ n’e v brov’ a v glaz,To hit not the eyebrow but the eye.,To guess right; to say something that is exactly right; to give the true explanation.,To hit the nail on the head; that hit the mark; you’ve said it!,0.0
400,401,ПОПАСТЬ ПАЛЬЦЕМ В НЕБО,popast’ pal’tsem v n’cbo,To hit the sky with one’s finger.,To say or do something that is far from - being correct or quite out of place; to answer irrelevantly.,To get/take the wrong sow by the ear; to be wide of /way off the mark,0.0
401,402,ПОПАСТЬСЯ НА чью-либо УДОЧКУ,popasttsa na lidochku,To be caught on someone’s fishing line.,"To permit oneself to be fooled; to fall for a hoax or trap; to accept a proposal, an offer, etc. made to tempt one to do something.",To swallow the bait: to rise to the fly; to be taken in; to fall into someone’s trap/snare,0.0
402,403,ПОРОХУ НЕ ВЫДУМАЕТ,porokhu n’e vydumayet,He will not invent gunpowder.,"He will never do anything remarkable or outstanding (usually said of a dull-witted, not very bright person).",He will never set the Thames/world on fire,0.0
403,404,ПОРОХУ HE ХВАТАЕТ,porokhu n’e khvatayet,Not enough gunpowder.,"One lacks energy, strength or resolution to do something.",It’s beyond him; he has not it in him; he is not up to it,0.0
404,405,ПОСАДИТЬ кого-либо В ГАЛОШУ,posadit’ v galoshu,To put someone into a galosh,Put someone into an embarrassing or uncomfortable situation; to be made fun of; to get someone into a fix; to be in an awkward predicament.,,0.0
407,408,ПОСЛЕДНЯЯ СПИЦА В КОЛЕСНИЦЕ,posl’edn’aya spitsa v kol’esnitse ,The last spoke in the chariot. ,A person of very little importance; one who doesn’t count; a minor figure.,A mere cog in the machine.,0.0
408,409,ПОСЛЕ ДОЖДИЧКА В ЧЕТВЕРГ,posl’e dozhdichka v chetv’erg,After a little rain on a Thursday.,No one knows when.,When pigs fly; when two Fridays come together,0.0
409,410,ПОСТАВИТЬ ВОПРОС РЕБРОМ,postavit’ vopros r’ebrom,To put a question edgewise.,"To announce or state something categorically; to say something in a manner that leaves no room for doubt; to ask something directly, openly; to put a question point-blank.",Not to mince words.,0.0
410,411,ПОСТАВИТЬ ВСЁ НА КАРТУ,postavit’ vs’o na kartu,To put everything on the card.,"To risk all that one has on a single venture, method, etc.; to stake all one’s hopes on one source or means.",To put all one’s eggs in one basket,0.0
411,412,ПОСТАВИТЬ кого-либо В ТУПИК,postavit’ v tupik,To put someone in a blind alley.,"To bewilder, to puzzle, to nonplus someone; to throw someone into confusion.",,0.0
412,413,ПОСТАВИТЬ КРЕСТ на ком-либо/чём-либо,postavit’ kr’est,To put a cross on someone/something,To lose faith in someone or something; to stop thinking of someone or something; to give someone up for lost; to give something up as a hopeless case.,To kiss something good-bye,0.0
417,418,ПРИЛОЖИТЬ РУКУ к чему-либо,prilozhit’ ruku,To put one’s hand on something,"To be actively involved in something (usually reprehensible, blameworthy).",To have/take a hand in something; to have a finger in the pie.,0.0
418,419,ПРИНИМАТЬ ЗА ЧИСТУЮ МОНЕТУ,prinimat’ za chistuyu mon’etu,To take for a pure coin.,To regard something as true; to take something seriously.,To take in good faith; to take at face value,0.0
420,421,ПРИТЯНУТЬ что-либо ЗА УШИ,prit’anut’ za ushi,To pull something up by the ears.,To make use of something without adequate grounds; to advance farfetched arguments.,To drag something in.,0.0
422,423,ПРОВАЛИТЬСЯ С ТРЕСКОМ,provalittsa s tr’eskom,To collapse with a bang,To flop; to be a complete and ignominious failure.,To come a cropper/crasher; to fall flat on one’s face.,0.0
425,426,ПРОЖУЖЖАТЬ ВСЕ УШИ,prozhuzhzhat’ vs’e lishi,To buzz someone’s ears through.,To bore someone by telling him some- thing over and over again; to keep dinging something into someone’s ears.,To talk someone’s ears off about something; to drone on at someone; to go rabbiting on,0.0
426,427,ПРОЙТИ КРАСНОЙ НИТЬЮ,proyti krasnoy nit’yu,To run through something with a red thread,"To be the basic idea, the key-note, the essence of something; to run through something (e. g. a book or a speech)",,0.0
428,429,ПРОЙТИСЬ ПО чьему-либо АДРЕСУ,proytis’ po adr’esu,To walk up and down someone’s address,To make a snide remark about someone; to make fun of someone; to make an implied criticism.,To have a fling at someone; go give someone a bad write-up,0.0
429,430,ПРОПУСКАТЬ МИМО УШЕЙ,propuskat’ mimo ushey ,To let something pass by one’s ears,To pay no attention or not to react to something that has been or is being said.,,0.0
430,431,ПРЯТАТЬ КОНЦЫ В ВОДУ,pr’atat’ kontsy v vodu,To hide the ends in water.,"To destroy evidence; to bury, remove every trace of something; to cover up one’s tracks.",And no one is the wiser.,0.0
431,432,ПТИЧЬЕГО МОЛОКА HE ХВАТАЕТ,ptich’yevo moloka n’e khvatayet,Someone lacks bird’s milk.,A great abundance of everything.,,0.0
432,433,ПУД СОЛИ СЪЕСТЬ с кем-либо,pud soli s’yest’,To eat a pood* of salt with someone,To live with or know someone for a long time; to spend a long time together with someone.,,0.0
433,434,ПУСКАТЬ КОЗЛА В ОГОРОД,puskat’ kozla v ogorod,To let the goat into the kitchen garden.,"To give someone access to a place where he may be particularly harmful or dangerous, or to something from which he wishes to profit.",,0.0
435,436,ПУШКОЙ HE ПРОШИБЁШЬ,pushkoy n’e proshib’osh,You won’t breach it with a cannon-ball.,"You can’t persuade him, you can’t influence him, you can’t budge him.",,0.0
436,437,РАБОТАТЬ ЗАСУЧИВ РУКАВА,rabotat’ zasuchiv rukava,To work with one’s sleeves rolled up. ,"To work assiduously, strenuously.",,0.0
437,438,РАБОТАТЬ HE ПОКЛАДАЯ РУК,rabotat’ n’e pokladaya ruk,To work without giving rest to one’s hands.,"To work unceasingly, tirelessly, indefatigably.",To be as busy as a bee,0.0
438,439,РАЗБИВАТЬСЯ В ЛЕПЁШКУ,razbivattsa v l’ep’oshku,"To do one’s utmost, to strain every nerve,",to do next to impossible to attain one’s end.,To lay oneself out; to go all out,0.0
439,440,РАЗВЕСИТЬ УШИ,razv’esit’ ushi,To hang out one’s ears,To be so carried away by what one hears that one doesn’t react properly or forgets about something important.,,0.0
442,443,РАЗРЯДИТЬ АТМОСФЕРУ,razr’adit’ atmosf’eru,To discharge the atmosphere.,To relieve tension; to create an atmosphere that will cool down a fiery argument.,To clear the air,0.0
443,444,РАСХЛЕБЫВАТЬ КАШУ,raskhl’obyvat’ kashu,To eat up kasha,To disentangle something; to put things right; to clear up a mess; to get oneself out of a mess.,,0.0
444,445,РВАТЬ И МЕТАТЬ,rvat’ i metat’,To tear and throw.,To get irritated; to be in a towering rage; to show angry impatience; to worry oneself into a state of temper.,To fret and fume,0.0
446,447,РВАТЬ кого-либо НА ЧАСТИ,rvat’ na chasti,To tear someone into pieces.,To pester someone with questions or requests; to bother someone too much; not to give someone any peace.,,0.0
447,448,РЕВЕТЬ БЕЛУГОЙ,revet’ belugoy,To roar like a beluga.,To wail; to scream; to howl with frenzy.,,0.0
448,449,РОДИТЬСЯ В СОРОЧКЕ,rodittsa v sorochk’e,To be born with a shirt on,"To be always lucky, successful, happy.",To always fall on one’s feet; to be born with a silver spoon in one’s mouth.,0.0
452,453,РУКА НЕ ДРОГНЕТ,ruka n’e drogn’et,One’s hand wouldn’t shake doing something.,One won’t hesitate to do something; one will do something without scruple.,One wouldn’t think twice about doing something; without a qualm.,0.0
453,454,РУКА HE ПОДНИМАЕТСЯ,ruka n’e podnimayetsa,One’s hand won’t rise.,One can’t bring himself to do something; one is hesitant about doing something.,Not to have the heart to do something.,0.0
454,455,РУКИ КОРОТКИ,ruki korotki,One’s hands are short.,"One doesn’t have enough authority, power or strength to do something; one is in no position to do something.",Just try! You coudn’t if you tried!,0.0
455,456,РУКИ HE ДОХОДЯТ,ruki n’e dokhod’at,One’s hands don’t reach.,One has no time or possibility to undertake something.,,0.0
457,458,РУКОЙ HE ДОСТАНЕШЬ,rukoy n’e dostan’esh,You can’t reach someone with your hand.,Someone is out of reach (usually said of someone in a high position).,,0.0
460,461,САДИТЬСЯ НА ШЕЮ,sadittsa na sheyu,To sit down on someone’s neck,To submit someone to one’s willy; to put someone under one’s complete control; to use someone as a tool.,To live off someone,0.0
461,462,САДИТЬСЯ HE В СВОИ САНИ,sadittsa n’e v svoi sani,To get into someone else’s sleigh.,"To undertake to do something one knows nothing about or which one who has inadequate knowledge, training, etc.; to occupy a post for which one is unsuited.",,0.0
462,463,САМИ С УСАМИ,sami s usami,We too have a moustache of our own.,Not young in wisdom; no worse than.,We weren’t born yesterday.,0.0
463,464,САПОГИ ВСМЯТКУ,sapogi vsm’atku,Soft-boiled boots.,"Rot, nonsense, rubbish, a trifling matter, nothing.",,0.0
469,470,СГЛАЖИВАТЬ ОСТРЫЕ УГЛЫ,sglazhivat’ ostryye ugly,To smooth sharp corners.,To smooth things over; to relieve the situation; to ease tension; to adjust differences,,0.0
471,472,СГУЩАТЬ КРАСКИ,sgushchat’ kraski,To thicken the paints.,To exaggerate; to picture something as being worse than it really is.,To lay it on thick,0.0
472,473,СДАВАТЬ В АРХИВ,sdavat’ v arkhiv,To relegate to the archives.,To dismiss as unfit for a particular use; to bury in oblivion as something obsolete or useless.,,0.0
473,474,СЕМЬ ПОТОВ СОШЛО,s’em’ potov soshlo,Seven sweats have come off.,One has exerted himself to the fullest to accomplish something.,To sweat one’s guts out,0.0
474,475,СЕМЬ ПЯТНИЦ НА НЕДЕЛЕ,s’em’ p’atnits na n’ed’el’e,Someone has seven Fridays in one week.,"Someone who easily and frequently changes his mind, mood or intentions.",Someone is in twenty minds; to chop and change,0.0
475,476,СЕРДЦЕ /ДУША HE ЛЕЖИТ к кому-либо/чему-либо,sertse/dusha n’e l’ezhit,sertse/dusha n’e l’ezhit,"One’s heart/soul doesn’t lie for something or someone. One feels great pity, compassion, grief; one feels something keenly, takes something hard.",To put one’s foot in it: to get oneself into a fix/spot,0.0
476,477,СЕРДЦЕ/ДУША РАЗРЫВАЕТСЯ НА ЧАСТИ,sertse/dusha razryvayetsa,One’s heart is breaking. ,"One feels great pity, compassion, grief; one feels something keenly, takes something hard.",One’s heart is breaking.,0.0
477,478,СЕСТЬ В ЛУЖУ,-j s’est’ v luzhu,To sit down into a puddle.,To get oneself into an awkward position or compromising situation; to let oneself be duped; to do or say something stupid.,To put one’s foot in it: to get oneself into a fix/spot.,0.0
480,481,СИДЕТЬ МЕЖДУ ДВУХ СТУЛЬЕВ,sid’et’ m’ezhdu dvukh stlil’yev,To sit between two chairs,"To try to adhere to two different, irreconcilable points of view: to try to keep the favour of both sides in a dispute",To run with the hare and hunt with the hounds; to play a double game.,0.0
481,482,СИДЕТЬ НА ЧЕМОДАНАХ,sid’et’ na chemodanakh,To sit on one’s suitcasesю,Packed and waiting to go.,,0.0
482,483,СИДЕТЬ СЛОЖА РУКИ,sid’et’ slozha niki,To sit with one’s arms folded.,To be idle; to sit still doing nothing.,To sit twiddling one’s thumbs,0.0
483,484,СКЛОНЯТЬ кого-либо ВО ВСЕХ ПАДЕЖАХ,sklon’at’ vo vs’ekh pad’ezhakh,To decline someone in all cases.,To talk a lot about someone at every opportunity (usually in a derogatory manner).,,0.0
485,486,"СКОЛЬКО ЛЕТ, СКОЛЬКО ЗИМ!",skol’ko l’et skol’ko zim,"So many summers, so many winters!",How long ago! (A greeting used when two people haven’t seen each other for a long time).,Long time no see! I haven’t seen you for ages! Fancy meeting you after all this time.,0.0
486,487,СЛАБАЯ СТРУНКА,slabaya striinka,A weak string.,The most vulnerable aspect of someone’s character; a matter upon which one is easily affected or most sensitive.,A weak/soft point,0.0
488,489,С ЛЁГКОЙ РУКИ,s l’okhkoy ruki,From the light hand of someone.,At someone’s initiative or following someone’s example which set in motion a series of subsequent actions or deeds.,,0.0
489,490,СЛЕД ПРОСТЫЛ,sl’ed prostyl,Someone’s footprints have grown cold.,"Someone has run away, disappeared; there’s not a trace of someone.",To vanish into thin air.,0.0
492,493,"СЛЫШНО, КАК МУХА ПРОЛЕТИТ",slyshno kak mukha prol’etit,One could hear a fly flying past.,It’s absolutely quiet; it’s deadly still.,You could hear a pin drop,0.0
493,494,СЛЮНКИ ТЕКУТ,sl’iinki t’ekut,Saliva is flowing.,Someone is anxious to partake of some tasty food or drink.,To make someone’s mouth water,0.0
497,498,СМОТРЕТЬ В ОБА,smotret’ v oba,To look through both.,To look attentively; to be closely observant; to be on the alert; to be particularly watchful,To keep one’s eyes peeled/skinned,0.0
498,499,СМОТРЕТЬ кому-либо В РОТ,smotr’et’ v rot,To look someone in the mouth.,To listen attentively and servilely to what one says; to fawn on someone.,To hang on someone’s words,0.0
500,501,СМОТРЕТЬ КАК БАРАН НА НОВЫЕ ВОРОТА,smotret’ kak baran na novyye vorota,To look at someone or something like a ram at a new gate.,"To look at someone or something with a puzzled, perplexed or dismayed expression on one s face; to look rather stupid, not understanding what is going on; to look quite lost.",,0.0
505,506,СНИМАТЬ с кого-либо СТРУЖКУ,snimat’ struzhku,To take the shavings off someone.,"To criticize someone severely, to rate someone soundly, to scold someone.",To tear someone off a strip.,0.0
507,508,СОБАКУ СЪЕЛ на чём-либо,sobaku s’yel,One has eaten the dog at something.,One has acquired great skill or experience in something; one knows something thoroughly; one is an expert in something.,To have something at one’s fingertips; to know something inside out; to know the ropes; he’s been around,0.0
509,510,СОН В РУКУ,son v ruku,The dream has come into one’s hand.,Said of a dream that has come true.,,0.0
511,512,CO СКРИПОМ,so skripom,With a creak.,"To do something very slowly, with great difficulty or effort, reluctantly.",,0.0
512,513,С ОТКРЫТОЙ ДУШОЙ/ ОТКРЫТЫМ СЕРДЦЕМ,s otkrytoy dushoy/otkrytym s’ertsem,With an open heart/soul,"To treat, someone or do something sincerely, trustfully, frankly, openly, without prejudice.",,0.0
513,514,СПАТЬ БЕЗ ЗАДНИХ НОГ,spat’ b’ez zadnikh nog ,To sleep without one’s hind legs.,To sleep soundly.,To sleep like a log/top,0.0
514,515,С ПЛЕЧ ДОЛОЙ,s pi’ech doloy,Off one’s shoulders. ,"One needn’t bother about something any longer; one no longer has an irksome burden to bear; one has got rid of duties, cares, responsibilities.","That’s done, thank goodness.",0.0
515,516,СПУТАТЬ ВСЕ КАРТЫ,sptitat’ vs’e karty,To mix up all the cards.,To spoil or ruin someone’s plans; to upset someone’s calculations.,To upset someone’s apple-cart.,0.0
516,517,СРАЖАТЬСЯ С ВЕТРЯНЫМИ МЕЛЬНИЦАМИ,srazhattsa s vetr’anymi m’el’nitsami,To fight against the windmills.,To waste energy in combating imaginary evils or difficulties; to attack an imaginary foe.,To tilt at windmills.,0.0
517,518,СТАВИТЬ ВО ГЛАВУ УГЛА,stavit’ vo glavu ugla,To put something in the vertex of an angle.,To assign primary importance to something; to consider something to be indispensible.,,0.0
518,519,СТАВИТЬ кого-либо НА НОГИ,stavit’ na nogi,To put someone on his feet.,To cure someone of an illness.,,0.0
519,520,СТАВИТЬ НА ОДНУ ДОСКУ,stavit’ na odnu dosku,To put someone on the same board with someone else.,To put someone on the same level with someone else; to consider one person comparable with another.,,0.0
520,521,СТАВИТЬ что-либо С НОГ НА ГОЛОВУ,stavit’ s nog na golovu,To put something from its feet into its head.,To give a distorted picture of something; to put things in the wrong order; to take the effect for the cause.,To put the cart before the horse,0.0
521,522,СТАВИТЬ ТОЧКИ НАД И,stavit’ tochki nad i,To put dots above the i’s,To make something clear and definite; to give most careful attention to detail.,To put the finishing touches to; to dot one’s i’s and cross one’s t’s.,0.0
523,524,СТАРО КАК МИР,staro kak mir,As old as the world.,"Very old, stale, uninteresting because heard before.",As old as the hills,0.0
524,525,СТИРАТЬ ГРАНИ,stirat’ grani,To grind off the edges.,To remove differences or distinctions.,,0.0
525,526,СТОИТ КАК ВКОПАННЫЙ,One stands as if dug in.,One stands as if dug in.,"One stands quite still, motionless.",To stand as if rooted to the ground.,0.0
526,527,СТОЯТЬ за кого-либо/что-либо ГОРОЙ,stoyat’ goroy,To stand for someone or something like a mountain.,"To defend someone or something with all one’s might, by every possible means; to be solidly behind someone or something; to stand firm or stick up for someone or something.",To stand for someone through thick and thing; to back someone up to the hilt.,0.0
527,528,СТОЯТЬ НАД ДУШОЙ,stoyat’ nad dushoy,To stand over someone’s soul.,To annoy someone by constantly watching him; to importune someone.,To stand over someone; to breath down someone’s neck; to worry the life out of someone.,0.0
528,529,СТОЯТЬ ПОПЕРЁК ГОРЛА,stoyat’ pop’er’ok gorla,To stand across someone’s throat.,"To become unbearable, unendurable; to be a source of annoyance, irritation, especially a persistent one.",A thorn in one’s flesh/side.,0.0
529,530,СТОЯТЬ ПОПЕРЁК ДОРОГИ,stoyat’ pop’er’ok dorogi,To stand across the road.,"To be an obstacle, hindrance or impediment to someone; to hamper someone’s chances of success or progress.",To be stand in someone’s way,0.0
530,531,СТРЕЛЯНЫЙ ВОРОБЕЙ,str’el’any vorob’ey,A sparrow that has been shot at.,A person experienced in the matter at hand; someone not easily deceived.,An old hand; a knowing old bird,0.0
531,532,СТРЕЛЯТЬ ИЗ ПУШКИ ПО ВОРОБЬЯМ,str’el’at’ is pushki po vorob’yam,To fire a cannon at sparrows.,To use an instrument or take measures far more powerful than is necessary; to make a great effort for a small gain.,To use a sledge-hammer to crack a nut; to break a fly/butterfly up on the wheel.,0.0
532,533,СТРИЧЬ ВСЕХ ПОД ОДНУ ГРЕБЁНКУ,strich vs’ekh pod odrni gr’eb’onku,To cut everyone’s hair with one comb.,To treat everyone alike; to reduce everyone to the same level; to judge all people the same way.,,0.0
535,536,СЧИТАТЬ ВОРОН,shchitat’ voron,To count the crows.,"To gape at something; to be distracted, inattentive; to be bored. ",,0.0
537,538,ТАНЦЕВАТЬ ОТ ПЕЧКИ,tantsevat’ ot p’echki,To dance from the stove.,"To begin with something that is elementary, familiar, or simpler, repeating all the movements or operations from the very beginning; to begin from the beginning.",,0.0
539,540,ТАЩИТЬ ЗА УШИ,tashchit’ za ushy,To pull someone by the ears.,"To do everything to help someone (usually one who is remiss and of less than average ability) in his studies, in obtaining promotion, etc.",,0.0
540,541,ТЁПЛОЕ МЕСТЕЧКО,t’oploye m’est’echko,A warm little place.,A highly paid appointment or job; a profitable position.,A cushy/snug job,0.0
543,544,"ТИШЕ ВОДЫ, НИЖЕ TPABЫ",tishe vody nizhe travy,"Quieter than water, lower than grass.","One is meek, timid, mild, quiet.",Quiet as a mouse; meek as a lamb.,0.0
544,545,ТОЛОЧЬ ВОДУ В СТУПЕ,toloch vodu v sttip’e,To pound the water in the mortar.,"To do useless work, to engage in fruitless talk that can have no results, to waste time.",To beat the air; to mill the wind.,0.0
545,546,ТРЕЩАТЬ ПО ШВАМ,tr’eshchat’ po shvam,To burst at the seams.,"To be on the verge of destruction, collapse, ruin.",To go/fall to pieces; to fall/burst apart at the seams.,0.0
546,547,ТЯЖЕЛАЯ АРТИЛЛЕРИЯ,t’azholaya artil’eriya,Heavy artillery.,Something that can be used in an emergency as an effective means of achieving an end.,,0.0
547,548,ТЯЖЁЛ НА ПОДЪЁМ,t’azhol na pod’yorn,t’azhol na pod’yom,"Heavy on the rise. Slow or unwilling to do something; sluggish, hard to move or rouse to action.",,0.0
548,549,ТЯНУТЬ ВРЕМЯ,t’amit’ vr’em’a,To drag the time.,To be slow in acting; to procrastinate; to wait for a favourable opportunity.,To bide one’s time,0.0
549,550,ТЯНУТЬ ЗА ЯЗЫК,t’arnit’ za yazyk,To pull someone by the tongue.,To make someone say something; to pump someone.,,0.0
550,551,УБИТЬ ДВУХ ЗАЙЦЕВ,ubit’ dvukh zaitsev,To kill two hares.,To achieve two objects simultaneously; to attain two results with one means.,To kill two birds with one stone.,0.0
551,552,УДАРИТЬ КАК ОБУХОМ ПО ГОЛОВЕ,udarit’ kak obukhom po golov’e,To strike as if with an axe-butt on the head.,"To amaze, to perplex, to stun someone; to take someone aback.",To knock someone down with a feather; to knock someone off his pins.,0.0
554,555,УЙТИ В КУСТЫ,uyti v kusty,To go into the scrubs.,To withdraw from one’s promise or an undertaking; to disclaim further responsibility for something.,To make oneself scarce; to back out; to show the white feather.,0.0
556,557,УЙТИ С ГОЛОВОЙ во что-либо,uyti z golovoy,To go headlong into something.,"To be fully absorbed, deeply engrossed or totally involved in something.",To throw oneself/plunge into something; to get up to one’s neck in something.,0.0
559,560,УНОСИТЬ НОГИ,unosit’ nogi,To carry away one’s legs.,To flee; to run as fast as one’s legs will carry one: to have a narrow escape.,To escape by the skin of one’s teeth.,0.0
562,563,УТЕРЕТЬ кому-либо НОС,ut’er’et’ nos,To wipe someone’s nose.,To win an advantage over someone; to humiliate or cause disgruntlement; to make a clever retort.,To score off someone; to get the better of someone; to steal a march on someone.,0.0
563,564,УХО РЕЖЕТ,ukho r’ezhet,Something cuts one’s ear.,It’s grating upon one’s ears; it’s painful to listen to; it offends the ear.,,0.0
564,565,УШИ ВЯНУТ,ushy v’anut,One’s ears fade.,"It is so ridiculous, absurd or silly that it’s disgusting to listen to.",It makes one sick to hear about it,0.0
565,566,ХВАТАТЬ ЗВЁЗДЫ С НЕБА,khvatat’ zv’ozdy s n’eba,To snatch the stars from the sky.,To be very good at something; to be able to do something remarkable.,He is as good as they come,0.0
566,567,ХВАТАТЬСЯ ЗА ГОЛОВУ,khvatattsa za golovu,To clutch one’s head.,To be struck with horror; to abandon oneself to despair.,,0.0
568,569,ХОДИТЬ ВОКРУГ ДА ОКОЛО,khodit’ vokriig da okolo,To walk round and about.,"To avoid saying something openly, frankly, directly; to avoid the essential facts; not to come to the point; to approach a matter in a roundabout way.",To beat about the bush,0.0
569,570,ХОДИТЬ НА ГОЛОВЕ,khodit’ na golov’e,To walk on one’s head.,To get into mischief; to play pranks; to be naughty (usually said of children).,,0.0
572,573,ХОТЬ ТРАВА НЕ РАСТИ,khot’ trava n’e rasti,Who cares whether or not the grass grows.,One couldn’t care less; it’s all the same to someone.,Not to care a straw,0.0
573,574,ХОТЬ ШАРОМ ПОКАТИ,khot’ sharom pokati,You could even roll a ball through it.,There’s nothing there; it’s completely empty.,Bare as a bone; as bare as the palm of one’s hand.,0.0
574,575,ХРОМАТЬ НА ОБЕ НОГИ,khromat’ na ob’e nogi,To limp on both legs;,"To have serious gaps in one’s knowledge, training or abilities.",,0.0
575,576,ХУДОЙ КАК СПИЧКА,khudoy kak spichka,Thin as a matchstick.,Very thin.,,0.0
576,577,ЦЕНЫ НЕТ кому-либо/чему-либо,tseny n’et,There’s no price on someone or something,"Someone or something is priceless, invaluable.",,0.0
578,579,ЧЕРЕЗ ЧАС ПО ЧАЙНОЙ ЛОЖКЕ,her’ez chas ро chaynoy lozhk’e,One teaspoonful every other hour.,To be few and at long intervals; very slowly.,In drops; in/by driblets; few and far between,0.0
