,id,head_ru,transliteration,literal,meaning,equivalents,transparency
579,580,ЧЁРНАЯ КОШКА ПРОБЕЖАЛА,chornaya koshka prob’ezhala,A black cat has run between them.,There’s a coolness between them; they have become estranged.,They have fallen out,0.0
584,585,ЧУДЕСА В РЕШЕТЕ,chudesa v r’eshet’e,Miracles in a sieve.,"It’s amazing, incredible, unbelievable extraordinary; it’s a fantastic tale.",,0.0
585,586,ЧУЖИМИ РУКАМИ ЖАР ЗАГРЕБАТЬ,chuzhimi rukami zhar zagr’ebat’,To bank up the fire with someone else’s hands.,To benefit by the results of someone else’s work; to use the results of someone else’s work to achieve one’s selfish ends.,To make a cat’s-paw of someone; to pull someone’s chestnuts out of the fire.,0.0
586,587,ШАПКАМИ ЗАКИДАЕМ,shapkami zakidayem,"We’ll pelt you (him, etc.) with our caps. ",We expect to win without difficulty; it’s as good as certain (to boast of an easy victory).,It’s a walk-over; it’s in the bag,0.0
587,588,ШАПОЧНОЕ ЗНАКОМСТВО,shapochnoye znakomstvo,A cap acquaintance.,A slight acquaintance.,A nodding/bowing acquaintance,0.0
588,589,ШИТО БЕЛЫМИ НИТКАМИ,shito b’elymi nitkami,It is sewn with white thread.,It is a flimsy story or excuse easily seen through; it is all too obvious; it is quite transparent.,Something does not hold water; made up out of whole cloth.,0.0
590,591,ЯБЛОКУ НЕГДЕ УПАСТЬ,yabloku n’egd’e upast’,No room for an apple to fall.,"Used to indicate that there is a large number of people in one place, that the place is overcrowded, that there is hardly room to move or turn around.",There’s no room to swing a cat,0.0
592,593,ЯЗЫК ХОРОШО ПОДВЕШЕН,yazyk horosho podv’eshen,One’s tongue is hung well.,Someone is a smooth talker; someone has a glib tongue.,To have the gift of the gab.,0.0
